<?xml version="1.0" encoding="UTF-8"?>
<xs:schema xmlns:xs="http://www.w3.org/2001/XMLSchema">
	<xs:element name="list">
		<xs:complexType>
			<xs:sequence>
				<xs:element name="fort">
					<xs:complexType>
						<xs:choice maxOccurs="unbounded" minOccurs="0">
							<xs:element name="spawns">
								<xs:complexType>
									<xs:sequence>
										<xs:element name="npc" maxOccurs="unbounded" minOccurs="0">
											<xs:complexType>
												<xs:attribute type="xs:int" name="id" use="optional" />
												<xs:attribute type="xs:int" name="x" use="required" />
												<xs:attribute type="xs:int" name="y" use="required" />
												<xs:attribute type="xs:int" name="z" use="required" />
												<xs:attribute type="xs:int" name="heading" use="optional" />
												<xs:attribute type="xs:int" name="castleId" use="optional" />
											</xs:complexType>
										</xs:element>
									</xs:sequence>
								</xs:complexType>
							</xs:element>
							<xs:element name="skills">
								<xs:complexType>
									<xs:sequence>
										<xs:element name="skill" maxOccurs="unbounded" minOccurs="0">
											<xs:complexType>
												<xs:attribute type="xs:int" name="id" use="required" />
												<xs:attribute type="xs:int" name="lvl" use="required" />
											</xs:complexType>
										</xs:element>
									</xs:sequence>
								</xs:complexType>
							</xs:element>
							<xs:element name="doors">
								<xs:complexType>
									<xs:sequence>
										<xs:element name="door" maxOccurs="unbounded" minOccurs="0">
											<xs:complexType>
												<xs:attribute type="xs:int" name="id" use="required" /><xs:attribute type="xs:string" name="group" use="optional" /></xs:complexType>
										</xs:element>
									</xs:sequence>
								</xs:complexType>
							</xs:element>
						</xs:choice>
						<xs:attribute type="xs:short" name="id" />
						<xs:attribute type="xs:string" name="name" />
					</xs:complexType>
				</xs:element>
			</xs:sequence>
		</xs:complexType>
	</xs:element>
</xs:schema>
